    1   0.000000 172.16.168.24 → 172.16.168.64 TCP 74 45275 → 554 [SYN] Seq=0 Win=5840 Len=0 MSS=1460 SACK_PERM=1 TSval=4294943454 TSecr=0 WS=4
    2   0.000111 172.16.168.64 → 172.16.168.24 TCP 74 554 → 45275 [SYN, ACK] Seq=0 Ack=1 Win=14480 Len=0 MSS=1460 SACK_PERM=1 TSval=47899697 TSecr=4294943454 WS=128
    3   0.000883 172.16.168.24 → 172.16.168.64 TCP 66 45275 → 554 [ACK] Seq=1 Ack=1 Win=5840 Len=0 TSval=4294943454 TSecr=47899697
    4   0.011442 172.16.168.24 → 172.16.168.64 TCP 196 [TCP segment of a reassembled PDU]
    5   0.011562 172.16.168.64 → 172.16.168.24 TCP 66 554 → 45275 [ACK] Seq=1 Ack=131 Win=15616 Len=0 TSval=47899700 TSecr=4294943455
    6   0.012362 172.16.168.24 → 172.16.168.64 RTSP/SDP 205 ANNOUNCE rtsp://172.16.168.64 RTSP/1.0
    7   0.012468 172.16.168.64 → 172.16.168.24 TCP 66 554 → 45275 [ACK] Seq=1 Ack=270 Win=16640 Len=0 TSval=47899700 TSecr=4294943455
    8   0.012714 172.16.168.64 → 172.16.168.24 RTSP 94 Reply: RTSP/1.0 200 OK
    9   0.013302 172.16.168.24 → 172.16.168.64 TCP 66 45275 → 554 [ACK] Seq=270 Ack=29 Win=5840 Len=0 TSval=4294943455 TSecr=47899700
   10   0.014900 172.16.168.24 → 172.16.168.64 RTSP 230 SETUP rtsp://172.16.168.64 RTSP/1.0
   11   0.016054 172.16.168.64 → 172.16.168.24 RTSP 238 Reply: RTSP/1.0 200 OK
   12   0.021838 172.16.168.24 → 172.16.168.64 TCP 74 40252 → 5000 [SYN] Seq=0 Win=5840 Len=0 MSS=1460 SACK_PERM=1 TSval=4294943456 TSecr=0 WS=4
   13   0.021948 172.16.168.64 → 172.16.168.24 TCP 74 5000 → 40252 [SYN, ACK] Seq=0 Ack=1 Win=14480 Len=0 MSS=1460 SACK_PERM=1 TSval=47899703 TSecr=4294943456 WS=128
   14   0.022605 172.16.168.24 → 172.16.168.64 TCP 66 40252 → 5000 [ACK] Seq=1 Ack=1 Win=5840 Len=0 TSval=4294943456 TSecr=47899703
   15   0.059680 172.16.168.24 → 172.16.168.64 TCP 66 45275 → 554 [ACK] Seq=434 Ack=201 Win=6912 Len=0 TSval=4294943460 TSecr=47899701
   16  82.903410  172.16.168.24 → 172.16.168.64 TCP 237 [TCP segment of a reassembled PDU]
   17  82.942325 172.16.168.64 → 172.16.168.24 TCP 66 554 → 45275 [ACK] Seq=201 Ack=605 Win=18816 Len=0 TSval=47920433 TSecr=4294951744
   18  82.943365 172.16.168.24 → 172.16.168.64 RTSP 386 RECORD rtsp://172.16.168.64 RTSP/1.0
   19  82.943457 172.16.168.64 → 172.16.168.24 TCP 66 554 → 45275 [ACK] Seq=201 Ack=925 Win=19840 Len=0 TSval=47920433 TSecr=4294951748
   20  82.943666 172.16.168.64 → 172.16.168.24 RTSP 131 Reply: RTSP/1.0 200 OK
   21  82.944401 172.16.168.24 → 172.16.168.64 TCP 66 45275 → 554 [ACK] Seq=925 Ack=266 Win=6912 Len=0 TSval=4294951748 TSecr=47920433
   22  82.945716 172.16.168.24 → 172.16.168.64 TCP 1280 40252 → 5000 [PSH, ACK] Seq=1 Ack=1 Win=5840 Len=1214 TSval=4294951748 TSecr=47899703
   23  82.945798 172.16.168.64 → 172.16.168.24 TCP 66 5000 → 40252 [ACK] Seq=1 Ack=1215 Win=17408 Len=0 TSval=47920433 TSecr=4294951748
   24  83.038945 172.16.168.24 → 172.16.168.64 TCP 1280 40252 → 5000 [PSH, ACK] Seq=1215 Ack=1 Win=5840 Len=1214 TSval=4294951757 TSecr=47920433
   25  83.038977 172.16.168.64 → 172.16.168.24 TCP 66 5000 → 40252 [ACK] Seq=1 Ack=2429 Win=20352 Len=0 TSval=47920457 TSecr=4294951757
   26  83.187801 172.16.168.24 → 172.16.168.64 TCP 1280 40252 → 5000 [PSH, ACK] Seq=2429 Ack=1 Win=5840 Len=1214 TSval=4294951772 TSecr=47920457
   27  83.187844 172.16.168.64 → 172.16.168.24 TCP 66 5000 → 40252 [ACK] Seq=1 Ack=3643 Win=23168 Len=0 TSval=47920494 TSecr=4294951772
   28  83.336951 172.16.168.24 → 172.16.168.64 TCP 1280 40252 → 5000 [PSH, ACK] Seq=3643 Ack=1 Win=5840 Len=1214 TSval=4294951787 TSecr=47920494
   29  83.337076 172.16.168.64 → 172.16.168.24 TCP 66 5000 → 40252 [ACK] Seq=1 Ack=4857 Win=26112 Len=0 TSval=47920531 TSecr=4294951787
   30  83.487930 172.16.168.24 → 172.16.168.64 TCP 1280 40252 → 5000 [PSH, ACK] Seq=4857 Ack=1 Win=5840 Len=1214 TSval=4294951802 TSecr=47920531
   31  83.488082 172.16.168.64 → 172.16.168.24 TCP 66 5000 → 40252 [ACK] Seq=1 Ack=6071 Win=29056 Len=0 TSval=47920569 TSecr=4294951802
   32  83.639473 172.16.168.24 → 172.16.168.64 TCP 1280 40252 → 5000 [PSH, ACK] Seq=6071 Ack=1 Win=5840 Len=1214 TSval=4294951817 TSecr=47920569
   33  83.639500 172.16.168.64 → 172.16.168.24 TCP 66 5000 → 40252 [ACK] Seq=1 Ack=7285 Win=31872 Len=0 TSval=47920607 TSecr=4294951817
   34  83.787889 172.16.168.24 → 172.16.168.64 TCP 1280 40252 → 5000 [PSH, ACK] Seq=7285 Ack=1 Win=5840 Len=1214 TSval=4294951832 TSecr=47920607
   35  83.788040 172.16.168.64 → 172.16.168.24 TCP 66 5000 → 40252 [ACK] Seq=1 Ack=8499 Win=34816 Len=0 TSval=47920644 TSecr=4294951832
   36  83.936929 172.16.168.24 → 172.16.168.64 TCP 1280 40252 → 5000 [PSH, ACK] Seq=8499 Ack=1 Win=5840 Len=1214 TSval=4294951847 TSecr=47920644
   37  83.936966 172.16.168.64 → 172.16.168.24 TCP 66 5000 → 40252 [ACK] Seq=1 Ack=9713 Win=37760 Len=0 TSval=47920681 TSecr=4294951847
   38  84.088655 172.16.168.24 → 172.16.168.64 TCP 1280 40252 → 5000 [PSH, ACK] Seq=9713 Ack=1 Win=5840 Len=1214 TSval=4294951862 TSecr=47920681
   39  84.088778 172.16.168.64 → 172.16.168.24 TCP 66 5000 → 40252 [ACK] Seq=1 Ack=10927 Win=40576 Len=0 TSval=47920719 TSecr=4294951862
   40  84.239582 172.16.168.24 → 172.16.168.64 TCP 1280 40252 → 5000 [PSH, ACK] Seq=10927 Ack=1 Win=5840 Len=1214 TSval=4294951877 TSecr=47920719
   41  84.239647 172.16.168.64 → 172.16.168.24 TCP 66 5000 → 40252 [ACK] Seq=1 Ack=12141 Win=42368 Len=0 TSval=47920757 TSecr=4294951877
   42  84.389247 172.16.168.24 → 172.16.168.64 TCP 1280 40252 → 5000 [PSH, ACK] Seq=12141 Ack=1 Win=5840 Len=1214 TSval=4294951892 TSecr=47920757
   43  84.389275 172.16.168.64 → 172.16.168.24 TCP 66 5000 → 40252 [ACK] Seq=1 Ack=13355 Win=42368 Len=0 TSval=47920794 TSecr=4294951892
   44  84.537607 172.16.168.24 → 172.16.168.64 TCP 1280 40252 → 5000 [PSH, ACK] Seq=13355 Ack=1 Win=5840 Len=1214 TSval=4294951907 TSecr=47920794
   45  84.537648 172.16.168.64 → 172.16.168.24 TCP 66 5000 → 40252 [ACK] Seq=1 Ack=14569 Win=42368 Len=0 TSval=47920831 TSecr=4294951907
   46  84.688938 172.16.168.24 → 172.16.168.64 TCP 1280 40252 → 5000 [PSH, ACK] Seq=14569 Ack=1 Win=5840 Len=1214 TSval=4294951922 TSecr=47920831
   47  84.688974 172.16.168.64 → 172.16.168.24 TCP 66 5000 → 40252 [ACK] Seq=1 Ack=15783 Win=42368 Len=0 TSval=47920869 TSecr=4294951922
   48  84.839735 172.16.168.24 → 172.16.168.64 TCP 1280 40252 → 5000 [PSH, ACK] Seq=15783 Ack=1 Win=5840 Len=1214 TSval=4294951937 TSecr=47920869
   49  84.839797 172.16.168.64 → 172.16.168.24 TCP 66 5000 → 40252 [ACK] Seq=1 Ack=16997 Win=42368 Len=0 TSval=47920907 TSecr=4294951937
   50  84.988774 172.16.168.24 → 172.16.168.64 TCP 1280 40252 → 5000 [PSH, ACK] Seq=16997 Ack=1 Win=5840 Len=1214 TSval=4294951952 TSecr=47920907
   51  85.026250 172.16.168.64 → 172.16.168.24 TCP 66 5000 → 40252 [ACK] Seq=1 Ack=18211 Win=42368 Len=0 TSval=47920954 TSecr=4294951952
   52  85.137658 172.16.168.24 → 172.16.168.64 TCP 1280 40252 → 5000 [PSH, ACK] Seq=18211 Ack=1 Win=5840 Len=1214 TSval=4294951967 TSecr=47920954
   53  85.174292 172.16.168.64 → 172.16.168.24 TCP 66 5000 → 40252 [ACK] Seq=1 Ack=19425 Win=42368 Len=0 TSval=47920991 TSecr=4294951967
   54  85.287470 172.16.168.24 → 172.16.168.64 TCP 1280 40252 → 5000 [PSH, ACK] Seq=19425 Ack=1 Win=5840 Len=1214 TSval=4294951982 TSecr=47920991
   55  85.326297 172.16.168.64 → 172.16.168.24 TCP 66 5000 → 40252 [ACK] Seq=1 Ack=20639 Win=42368 Len=0 TSval=47921029 TSecr=4294951982
   56  85.454149 172.16.168.24 → 172.16.168.64 TCP 236 [TCP segment of a reassembled PDU]
   57  85.490263 172.16.168.64 → 172.16.168.24 TCP 66 554 → 45275 [ACK] Seq=266 Ack=1095 Win=20992 Len=0 TSval=47921070 TSecr=4294951999
   58  85.492043 172.16.168.24 → 172.16.168.64 RTSP 267 PAUSE rtsp://172.16.168.64 RTSP/1.0
   59  85.492122 172.16.168.64 → 172.16.168.24 TCP 66 554 → 45275 [ACK] Seq=266 Ack=1296 Win=22016 Len=0 TSval=47921070 TSecr=4294952003
   60  85.492476 172.16.168.64 → 172.16.168.24 RTSP 131 Reply: RTSP/1.0 200 OK
   61  85.493326 172.16.168.24 → 172.16.168.64 TCP 66 45275 → 554 [ACK] Seq=1296 Ack=331 Win=6912 Len=0 TSval=4294952003 TSecr=47921070
   62 107.513836  172.16.168.24 → 172.16.168.64 TCP 237 [TCP segment of a reassembled PDU]
   63 107.550410 172.16.168.64 → 172.16.168.24 TCP 66 554 → 45275 [ACK] Seq=331 Ack=1467 Win=23168 Len=0 TSval=47926585 TSecr=4294954205
   64 107.552548 172.16.168.24 → 172.16.168.64 RTSP 385 RECORD rtsp://172.16.168.64 RTSP/1.0
   65 107.552658 172.16.168.64 → 172.16.168.24 TCP 66 554 → 45275 [ACK] Seq=331 Ack=1786 Win=24192 Len=0 TSval=47926585 TSecr=4294954209
   66 107.552859 172.16.168.64 → 172.16.168.24 RTSP 131 Reply: RTSP/1.0 200 OK
   67 107.553769 172.16.168.24 → 172.16.168.64 TCP 66 45275 → 554 [ACK] Seq=1786 Ack=396 Win=6912 Len=0 TSval=4294954209 TSecr=47926585
   68 107.555048 172.16.168.24 → 172.16.168.64 TCP 1280 40252 → 5000 [PSH, ACK] Seq=20639 Ack=1 Win=5840 Len=1214 TSval=4294954209 TSecr=47921029
   69 107.555152 172.16.168.64 → 172.16.168.24 TCP 66 5000 → 40252 [ACK] Seq=1 Ack=21853 Win=42368 Len=0 TSval=47926586 TSecr=4294954209
   70 107.642312 172.16.168.24 → 172.16.168.64 TCP 1280 40252 → 5000 [PSH, ACK] Seq=21853 Ack=1 Win=5840 Len=1214 TSval=4294954218 TSecr=47926586
   71 107.642431 172.16.168.64 → 172.16.168.24 TCP 66 5000 → 40252 [ACK] Seq=1 Ack=23067 Win=42368 Len=0 TSval=47926608 TSecr=4294954218
   72 107.790193 172.16.168.24 → 172.16.168.64 TCP 1280 40252 → 5000 [PSH, ACK] Seq=23067 Ack=1 Win=5840 Len=1214 TSval=4294954232 TSecr=47926608
   73 107.790260 172.16.168.64 → 172.16.168.24 TCP 66 5000 → 40252 [ACK] Seq=1 Ack=24281 Win=42368 Len=0 TSval=47926644 TSecr=4294954232
   74 107.939306 172.16.168.24 → 172.16.168.64 TCP 1280 40252 → 5000 [PSH, ACK] Seq=24281 Ack=1 Win=5840 Len=1214 TSval=4294954247 TSecr=47926644
   75 107.939403 172.16.168.64 → 172.16.168.24 TCP 66 5000 → 40252 [ACK] Seq=1 Ack=25495 Win=42368 Len=0 TSval=47926682 TSecr=4294954247
   76 108.090214 172.16.168.24 → 172.16.168.64 TCP 1280 40252 → 5000 [PSH, ACK] Seq=25495 Ack=1 Win=5840 Len=1214 TSval=4294954262 TSecr=47926682
   77 108.090243 172.16.168.64 → 172.16.168.24 TCP 66 5000 → 40252 [ACK] Seq=1 Ack=26709 Win=42368 Len=0 TSval=47926719 TSecr=4294954262
   78 108.242271 172.16.168.24 → 172.16.168.64 TCP 1280 40252 → 5000 [PSH, ACK] Seq=26709 Ack=1 Win=5840 Len=1214 TSval=4294954278 TSecr=47926719
   79 108.242304 172.16.168.64 → 172.16.168.24 TCP 66 5000 → 40252 [ACK] Seq=1 Ack=27923 Win=42368 Len=0 TSval=47926757 TSecr=4294954278
   80 108.393955 172.16.168.24 → 172.16.168.64 TCP 1280 40252 → 5000 [PSH, ACK] Seq=27923 Ack=1 Win=5840 Len=1214 TSval=4294954293 TSecr=47926757
   81 108.394072 172.16.168.64 → 172.16.168.24 TCP 66 5000 → 40252 [ACK] Seq=1 Ack=29137 Win=42368 Len=0 TSval=47926795 TSecr=4294954293
   82 108.539047 172.16.168.24 → 172.16.168.64 TCP 1280 40252 → 5000 [PSH, ACK] Seq=29137 Ack=1 Win=5840 Len=1214 TSval=4294954307 TSecr=47926795
   83 108.539146 172.16.168.64 → 172.16.168.24 TCP 66 5000 → 40252 [ACK] Seq=1 Ack=30351 Win=42368 Len=0 TSval=47926832 TSecr=4294954307
   84 108.690289 172.16.168.24 → 172.16.168.64 TCP 1280 40252 → 5000 [PSH, ACK] Seq=30351 Ack=1 Win=5840 Len=1214 TSval=4294954322 TSecr=47926832
   85 108.690312 172.16.168.64 → 172.16.168.24 TCP 66 5000 → 40252 [ACK] Seq=1 Ack=31565 Win=42368 Len=0 TSval=47926869 TSecr=4294954322
   86 108.842261 172.16.168.24 → 172.16.168.64 TCP 1280 40252 → 5000 [PSH, ACK] Seq=31565 Ack=1 Win=5840 Len=1214 TSval=4294954338 TSecr=47926869
   87 108.842299 172.16.168.64 → 172.16.168.24 TCP 66 5000 → 40252 [ACK] Seq=1 Ack=32779 Win=42368 Len=0 TSval=47926907 TSecr=4294954338
   88 108.990281 172.16.168.24 → 172.16.168.64 TCP 1280 40252 → 5000 [PSH, ACK] Seq=32779 Ack=1 Win=5840 Len=1214 TSval=4294954352 TSecr=47926907
   89 108.990401 172.16.168.64 → 172.16.168.24 TCP 66 5000 → 40252 [ACK] Seq=1 Ack=33993 Win=42368 Len=0 TSval=47926944 TSecr=4294954352
   90 109.139230 172.16.168.24 → 172.16.168.64 TCP 1280 40252 → 5000 [PSH, ACK] Seq=33993 Ack=1 Win=5840 Len=1214 TSval=4294954367 TSecr=47926944
   91 109.139267 172.16.168.64 → 172.16.168.24 TCP 66 5000 → 40252 [ACK] Seq=1 Ack=35207 Win=42368 Len=0 TSval=47926982 TSecr=4294954367
   92 109.290137 172.16.168.24 → 172.16.168.64 TCP 1280 40252 → 5000 [PSH, ACK] Seq=35207 Ack=1 Win=5840 Len=1214 TSval=4294954382 TSecr=47926982
   93 109.290266 172.16.168.64 → 172.16.168.24 TCP 66 5000 → 40252 [ACK] Seq=1 Ack=36421 Win=42368 Len=0 TSval=47927019 TSecr=4294954382
   94 109.448956 172.16.168.24 → 172.16.168.64 TCP 1280 40252 → 5000 [PSH, ACK] Seq=36421 Ack=1 Win=5840 Len=1214 TSval=4294954398 TSecr=47927019
   95 109.449028 172.16.168.64 → 172.16.168.24 TCP 66 5000 → 40252 [ACK] Seq=1 Ack=37635 Win=42368 Len=0 TSval=47927059 TSecr=4294954398
   96 109.588608 172.16.168.24 → 172.16.168.64 TCP 1280 40252 → 5000 [PSH, ACK] Seq=37635 Ack=1 Win=5840 Len=1214 TSval=4294954412 TSecr=47927059
   97 109.588644 172.16.168.64 → 172.16.168.24 TCP 66 5000 → 40252 [ACK] Seq=1 Ack=38849 Win=42368 Len=0 TSval=47927094 TSecr=4294954412
   98 109.767041 172.16.168.24 → 172.16.168.64 TCP 236 [TCP segment of a reassembled PDU]
   99 109.806440 172.16.168.64 → 172.16.168.24 TCP 66 554 → 45275 [ACK] Seq=396 Ack=1956 Win=25216 Len=0 TSval=47927149 TSecr=4294954430
  100 109.807449 172.16.168.24 → 172.16.168.64 RTSP 266 PAUSE rtsp://172.16.168.64 RTSP/1.0
  101 109.807547 172.16.168.64 → 172.16.168.24 TCP 66 554 → 45275 [ACK] Seq=396 Ack=2156 Win=26368 Len=0 TSval=47927149 TSecr=4294954434
  102 109.807894 172.16.168.64 → 172.16.168.24 RTSP 131 Reply: RTSP/1.0 200 OK
  103 109.808803 172.16.168.24 → 172.16.168.64 TCP 66 45275 → 554 [ACK] Seq=2156 Ack=461 Win=6912 Len=0 TSval=4294954434 TSecr=47927149
